{
    "name": "Tibea Lamp E27 Tuneable White 2000lm",
    "standby_usage": 0.51,
    "supported_modes": [
        "lut"
    ],
    "measure_method": "script",
    "measure_device": "Shelly Plug S",
    "measure_description": "Measured twice with script made by bramstroker and partially verified manual"
}
