{
    "name": "WeMo smart LED bulb",
    "standby_usage": 0.4,
    "supported_modes": [
        "lut"
    ],
    "measure_method": "manual",
    "measure_device": "RRPM02 (Model); 4897037690801 (Barcode); Reduction Revolution Plug-in Power Meter",
    "measure_description": "Was not able to measure the standby usage, the value is assumed"
}
