{
    "name": "Hue White 1600 A67 E27 1600lm",
    "standby_usage": 0.41,
    "supported_modes": [
        "lut"
    ],
    "measure_method": "script",
    "measure_device": "Shelly Plug S",
    "measure_description": "Measured twice with script made by bramstroker using 9 sec pauses and partially verified manual"
}
