{
    "name": "TRADFRI bulb E27 WS clear 950lm LED1546G12",
    "standby_usage": 0.43,
    "supported_modes": [
        "lut"
    ],
    "measure_method": "script",
    "measure_device": "Shelly Plug S",
    "measure_description": "Measured with script made by bramstroker and partially verified manual"
}
