{
    "measure_device": "Sonoff DualR3",
    "measure_description": "Took several readings on every 10% of the lamp and did a linear regression to estimate the correct consumptions. Standby usage is assumed",
    "measure_method": "script",
    "name": "Sonoff B02 Light with dimmer and temperature",
    "standby_usage": 0.4,
    "supported_modes": [
        "lut"
    ]
}
