{
    "name": "Hue White Ambiance E27",
    "standby_usage": 0.29,
    "supported_modes": [
        "lut"
    ],
    "measure_method": "script",
    "measure_device": "TP-Link HS110",
    "measure_description": "Measured with script made by smonesi (steps: bri 30/mired 30) and linearly interpolated to provide more data"
}
