{
    "name": "Hue Go 2.0",
    "standby_usage": 0.49,
    "measure_method": "script",
    "measure_device": "TP-Link HS110",
    "measure_description": "Measured with measure_v2 script made by smonesi (SAMPLE_COUNT=6, steps: bri 40/sat 40/mired 30/hue 2000) and linearly interpolated to provide more data",
    "supported_modes": [
        "lut"
    ]
}
