{
    "name": "TRADFRI bulb E27 WS opal 1000lm LED1732G11",
    "standby_usage": 0.26,
    "supported_modes": [
        "lut"
    ],
    "measure_method": "script",
    "measure_device": "Shelly Plug S",
    "measure_description": "Measured with script made by bramstroker and partially verified manual"
}
