{
    "name": "Hue Play",
    "standby_usage": 0.100,
    "supported_modes": [
        "lut"
    ],
    "measure_method": "script",
    "measure_device": "TP-Link HS110",
    "measure_description": "Measured with script made by smonesi (steps: bri 20/sat 40/mired 30/hue 2000) and linearly interpolated to provide more data"
}
